=========================================
1959 AX-1 INPUT ECHO
=========================================

CONTROL PARAMETERS:
  Eigenmode:         alpha
  Initial Δt:         2.00000E+00 μsec
  Maximum Δt:         2.00000E+00 μsec
  End time:           3.20000E+02 μsec
  CSC (Courant):        3.000
  CVP (Viscosity):      2.000
  W limit:              0.300
  Hydro/Neutron:         1

GEOMETRY:
  Number of zones:      39
  Radii (cm):
    1  9.500000E-01
    2  1.900000E+00
    3  2.850000E+00
    4  3.800000E+00
    5  4.750000E+00
    6  5.700000E+00
    7  6.650000E+00
    8  7.600000E+00
    9  8.550000E+00
   10  9.500000E+00
   11  1.045000E+01
   12  1.140000E+01
   13  1.235000E+01
   14  1.330000E+01
   15  1.425000E+01
   16  1.520000E+01
   17  1.615000E+01
   18  1.710000E+01
   19  1.805000E+01
   20  1.900000E+01
   21  1.995000E+01
   22  2.090000E+01
   23  2.185000E+01
   24  2.280000E+01
   25  2.375000E+01
   26  2.470000E+01
   27  2.565000E+01
   28  2.660000E+01
   29  2.755000E+01
   30  2.850000E+01
   31  3.030000E+01
   32  3.210000E+01
   33  3.390000E+01
   34  3.570000E+01
   35  3.750000E+01
   36  3.930000E+01
   37  4.110000E+01
   38  4.290000E+01
   39  4.470000E+01
   40  0.000000E+00

INITIAL CONDITIONS:
  Zone  Mat    Density      Temp
              (g/cc)       (keV)
    2    1  7.920000E+00  1.000000E-04
    3    1  7.920000E+00  1.000000E-04
    4    1  7.920000E+00  1.000000E-04
    5    1  7.920000E+00  1.000000E-04
    6    1  7.920000E+00  1.000000E-04
    7    1  7.920000E+00  1.000000E-04
    8    1  7.920000E+00  1.000000E-04
    9    1  7.920000E+00  1.000000E-04
   10    1  7.920000E+00  1.000000E-04
   11    1  7.920000E+00  1.000000E-04
   12    1  7.920000E+00  1.000000E-04
   13    1  7.920000E+00  1.000000E-04
   14    1  7.920000E+00  1.000000E-04
   15    1  7.920000E+00  1.000000E-04
   16    1  7.920000E+00  1.000000E-04
   17    1  7.920000E+00  1.000000E-04
   18    1  7.920000E+00  1.000000E-04
   19    1  7.920000E+00  1.000000E-04
   20    1  7.920000E+00  1.000000E-04
   21    1  7.920000E+00  1.000000E-04
   22    1  7.920000E+00  1.000000E-04
   23    1  7.920000E+00  1.000000E-04
   24    1  7.920000E+00  1.000000E-04
   25    1  7.920000E+00  1.000000E-04
   26    2  1.583000E+01  5.000000E-05
   27    2  1.583000E+01  5.000000E-05
   28    2  1.583000E+01  5.000000E-05
   29    2  1.583000E+01  5.000000E-05
   30    2  1.583000E+01  5.000000E-05
   31    2  1.583000E+01  5.000000E-05
   32    2  1.583000E+01  5.000000E-05
   33    2  1.583000E+01  5.000000E-05
   34    2  1.583000E+01  5.000000E-05
   35    2  1.583000E+01  5.000000E-05
   36    2  1.583000E+01  5.000000E-05
   37    2  1.583000E+01  5.000000E-05
   38    2  1.583000E+01  5.000000E-05
   39    2  1.583000E+01  5.000000E-05

MATERIALS:   2 materials
Material   1
  Groups:   1
  EOS: P = ALPHA*rho + BETA*theta + TAU
    ALPHA =  2.87300E-02
    BETA  =  2.78460E+02
    TAU   = -3.94600E-01
  Specific heat: Cv = ACV + BCV*theta
    ACV   =  1.21630E+01
    BCV   =  5.78000E+03

Material   2
  Groups:   1
  EOS: P = ALPHA*rho + BETA*theta + TAU
    ALPHA =  2.87300E-02
    BETA  =  2.78460E+02
    TAU   = -4.68719E-01
  Specific heat: Cv = ACV + BCV*theta
    ACV   =  1.21630E+01
    BCV   =  5.78000E+03

=========================================

=========================================
1959 AX-1 TRANSIENT RESULTS
=========================================

  TIME      QP        POWER     ALPHA      K-EFF      DELT       W     R_MAX
 (μsec)  (10¹² erg) (arb)    (μsec⁻¹)              (μsec)             (cm)
-----------------------------------------------------------------------------------------
 2.000000  3.6532E+03  1.0000E+00    0.012940  1.003209  1.0000E+00  1.1716   43.8467
13.000000  3.6641E+03  1.1530E+00    0.012940  1.003209  2.0000E+00  0.0178   43.8467
23.000000  3.6763E+03  1.3123E+00    0.012940  1.003209  2.0000E+00  0.0184   43.8467
33.000000  3.6900E+03  1.4936E+00    0.012940  1.003209  2.0000E+00  0.0191   43.8467
43.000000  3.7055E+03  1.6999E+00    0.012940  1.003209  2.0000E+00  0.0198   43.8467
53.000000  3.7230E+03  1.9347E+00    0.012940  1.003209  2.0000E+00  0.0207   43.8467
63.000000  3.7429E+03  2.2020E+00    0.012940  1.003209  2.0000E+00  0.0216   43.8467
73.000000  3.7653E+03  2.5062E+00    0.012940  1.003209  2.0000E+00  0.0227   43.8467
83.000000  3.7907E+03  2.8525E+00    0.012940  1.003209  2.0000E+00  0.0239   43.8467
93.000000  3.8194E+03  3.2465E+00    0.012940  1.003209  2.0000E+00  0.0253   43.8467
*********  3.8519E+03  3.6950E+00    0.012940  1.003209  2.0000E+00  0.0268   43.8467
*********  3.8887E+03  4.2055E+00    0.012940  1.003209  2.0000E+00  0.0286   43.8467
*********  3.9303E+03  4.7865E+00    0.012940  1.003209  2.0000E+00  0.0306   43.8467
*********  3.9773E+03  5.4478E+00    0.012940  1.003209  2.0000E+00  0.0329   43.8467
*********  4.0305E+03  6.2004E+00    0.012940  1.003209  2.0000E+00  0.0354   43.8467
*********  4.0907E+03  7.0570E+00    0.012940  1.003209  2.0000E+00  0.0383   43.8467
*********  4.1588E+03  8.0319E+00    0.012940  1.003209  2.0000E+00  0.0416   43.8467
*********  4.2359E+03  9.1415E+00    0.012940  1.003209  2.0000E+00  0.0453   43.8467
*********  4.3230E+03  1.0404E+01    0.012940  1.003209  2.0000E+00  0.0494   43.8467
*********  4.4216E+03  1.1842E+01    0.012940  1.003209  2.0000E+00  0.0542   43.8467
*********  4.5332E+03  1.3478E+01    0.012940  1.003209  2.0000E+00  0.0595   43.8467
*********  4.6594E+03  1.5340E+01    0.012940  1.003209  2.0000E+00  0.0656   43.8467
*********  4.8021E+03  1.7459E+01    0.012940  1.003209  2.0000E+00  0.0724   43.8467
*********  4.9636E+03  1.9871E+01    0.012940  1.003209  2.0000E+00  0.0802   43.8467
*********  5.1463E+03  2.2616E+01    0.012940  1.003209  2.0000E+00  0.0889   43.8467
*********  5.3530E+03  2.5740E+01    0.012940  1.003209  2.0000E+00  0.0988   43.8467
*********  5.5868E+03  2.9296E+01    0.012940  1.003209  2.0000E+00  0.1100   43.8467
*********  5.8514E+03  3.3343E+01    0.012940  1.003209  2.0000E+00  0.1329   43.8467
*********  6.1474E+03  3.7106E+01    0.009190  1.003209  2.0000E+00  0.1361   43.8467
*********  6.4678E+03  3.9772E+01    0.005440  1.003209  2.0000E+00  0.2067   43.8467
*********  6.7970E+03  4.1039E+01    0.000190  1.003209  1.0000E+00  0.1247   43.8467
*********  7.1142E+03  3.9431E+01   -0.005060  1.003209  2.5000E-01  0.0665   43.8467
*********  7.2898E+03  3.6186E+01   -0.017060  1.003209  3.9062E-03  0.1662   43.8467

=========================================
SIMULATION SUMMARY
=========================================
Final time:                320.000000 μsec
Hydro cycles:                  4696
Total S4 iterations:            570
Final alpha:              -1.705960E-02
Final k-eff:                 1.003209
Final energy:              7.289753E+03 × 10¹² ergs
Final KE:                  5.398541E+04 × 10¹² ergs
Final IE:                  5.765983E+03 × 10¹² ergs
Energy balance CHECK:     -1.428177E+02
Final radius:                 43.8467 cm
Final max temp:                0.0075 keV
Final max pressure:        2.998600E+02 megabars
=========================================
